,Unnamed: 0,City,title,company,salary,summary
323,323,"Charlotte,NC","Server, Bartender, Busser, Runner, Guest Services - Charlott...",Topgolf,,"If extended the invitation, we’ll be ready to welcome you to an interview with guidelines around social distancing and interview protocols to help keep you safe…"
324,324,"Charlotte,NC",Warehouse/Material Handler,Frito-Lay North America,$18.43 an hour,Safely operate a forklift after we provide you training and you obtain certification.Load trailers via carts or stack cases on the floor of a truck trailer.
325,325,"Charlotte,NC",Front Office Assistant,BG Solutions,"$40,000 - $50,000 a year","In this role, your duties will include answering incoming calls, scheduling appointments, and welcoming visitors.Copying, scanning, and filing documents."
326,326,"Charlotte,NC",Appointment Setter - Interview This Week,The Williams Group of FL,"$800 - $1,200 a week","Own a reliable vehicle and have a driver's license.We fully train, so no experience is required for this position.Weekly pay and weekly bonuses."
327,327,"Charlotte,NC","Assistant, Media Center / 2021-22",Charlotte-Mecklenburg Schools,$15 an hour,"Provides basic instruction and guidance to students using educational computer hardware and software.Duties include maintaining media center collections,…"
328,328,"Charlotte,NC",Customer Care Associate,Carewell,$13 - $18 an hour,"70% on calls: The bulk of your time will be spent answering calls from customers to assist with order placement, reorders, de-escalation, product questions and…"
329,329,"Charlotte,NC",Guest Services Representative,Novant Health,,Licensure/certification/registration: Valid state driver’s license at facilities where valet assistance may be needed is required.
330,330,"Charlotte,NC",Police Records Clerk,Town of Dallas,$32 an hour,"In addition to this, the Police Records Clerk may also perform other clerical duties assisting officers with information and answering the phone."
331,331,"Charlotte,NC",Special Agent,Federal Bureau of Investigation,"$62,556 - $80,721 a year","Possess a valid driver’s license with at least six months driving experience.You will have an opportunity to work with federal, state and local law enforcement…"
332,332,"Charlotte,NC","Store Manager / District Manager: Structured Hours, Full Ben...",The Connor Group,"$75,000 - $110,000 a year","Real advancement opportunities based off performance.Outstanding compensation and bonus plan.Best in the industry benefits, 401k, longevity bonus and more!"
333,333,"Charlotte,NC",Warehouse/Material Handler,Frito-Lay North America,$18.43 an hour,Safely operate a forklift after we provide you training and you obtain certification.Load trailers via carts or stack cases on the floor of a truck trailer.
334,334,"Charlotte,NC",Warehouse Team Member,Amazon HVH,,"Overnight, Early Morning, Day, Evening, Weekend.From flexible part-time roles to full-time set schedules with health care benefits, Amazon has a variety of…"
335,335,"Charlotte,NC",Data Entry Clerk,Manpower,$17 an hour,FREE College and up skilling courses available.Clerical Document Processors will be responsible for data keying and expected to maintain high levels of…
336,336,"Charlotte,NC",Mail Clerk,Manpower,$16 an hour,"Prepare incoming and outgoing mail for distribution.Use hand or mail handling machines to time stamp, open, read, sort, and route incoming mail; and address,…"
337,337,"Charlotte,NC",,The Connor Group,"$75,000 - $110,000 a year","Real advancement opportunities based off performance.Outstanding compensation and bonus plan.Best in the industry benefits, 401k, longevity bonus and more!"
338,338,"Charlotte,NC",Immediate Opening- Assistant Front Desk,CDS Concierge,$14 - $17 an hour,Maintain an active presence in the concierge lobby to greet and assist incoming guests.Give courtesy calls to new move ins and find ways to impress guest and…
339,339,"Charlotte,NC",Warehouse Associate,Tesla,,"Must have a valid state driver’s license.This will include receiving, issuing, and organizing materials for maximum efficiency; and preparing material daily to…"
340,340,"Charlotte,NC",Special Agent,Federal Bureau of Investigation,"$62,556 - $80,721 a year","Possess a valid driver’s license with at least six months driving experience.You will have an opportunity to work with federal, state and local law enforcement…"
341,341,"Charlotte,NC",Customer Service Agent,Williams-Sonoma Inc. Customer Care Centers,$14 an hour,"Agents are trained in taking calls to assist customers with anything from placing orders and facilitating returns, to locating products and scheduling…"
342,342,"Charlotte,NC",Front Desk Associate,Xclusive Staffing - Corporate,$13 an hour,Xclusive Staffing is currently seeking a Front Desk Associate to ensure successful operation of front desk and all administrative functions.
343,343,"Charlotte,NC",DA Victim Services Coordinator,North Carolina District Attorney,"$32,780 - $38,769 a year","Skill in: Microsoft Office Word, Excel, Outlook, and PowerPoint; accurately typing 35-40 wpm; and answering a multi-line telephone system."
344,344,"Charlotte,NC",Recreation Specialist,Mecklenburg County Government,$16 - $20 an hour,Licenses and Certifications*: Position may require a valid North Carolina or South Carolina’s driver’s license and the ability to obtain and maintain a County…
345,345,"Charlotte,NC","Luxury Leasing Consultant: Structured Hours, Uncapped Bonuse...",The Connor Group,$19 - $22 an hour,"Full Benefits, Guaranteed Hours & Un-Capped Bonuses!Adaptable/flexible -- enjoys doing work that requires frequent shifts in direction."
346,346,"Charlotte,NC",Rail Car Technician,City of Charlotte and Mecklenburg County,$25.25 - $33.14 an hour,"Must have a valid driver's license and the ability to attain a North Carolina driver's license within the timelines outlined by CATS and the City of Charlotte,…"
347,347,"Charlotte,NC",Pharmaceutical Sales Representative (Entry Level - Primary C...,Prism Pharmaceutical,"$71,300 - $94,100 a year",Possess a valid driver’s license.Ability to understand and communicate highly scientific and technical medical information.
348,348,"Charlotte,NC",,Foxtrot Aviation Services,$14.10 an hour,"Valid Driver License - Reliable Transportation - Working cell phone - Must pass a drug screening - Capable of lifting, twisting and standing on feet for several…"
349,349,"Charlotte,NC",Warehouse Team Member,Amazon HVH,,"Overnight, Early Morning, Day, Evening, Weekend.From flexible part-time roles to full-time set schedules with health care benefits, Amazon has a variety of…"
350,350,"Charlotte,NC",Patient Support Specialist,Lemonaid Health,$14 an hour,"Comfortable with handling a high volume of calls and emails, while upholding our customer commitment of answering calls within 60 seconds and replying to emails…"
351,351,"Charlotte,NC",Full-Time Maid/House Cleaner $700-800 paid Weekly,Dust and Mop Cleaning,$700 - $800 a week,Work closely with Shirley and Darleen as they teach you how to make top pay in a few weeks time.- Have good work supplies provided for you*.
352,352,"Charlotte,NC",Route Sales Representative,Frito-Lay North America,"$50,000 a year","As a Route Sales Representative, you would drive a small Frito-Lay truck which requires a regular driver's license and insurance."
353,353,"Charlotte,NC","Warehouse Processing, Packaging, & Shipping Associate $13-16...",JLS Trading Co,$13 - $16 an hour,"Working on a small manufacturing line to assemble units, package them, apply a label, then box up the finished unit.Moving pallets around the warehouse."
354,354,"Charlotte,NC",Receptionist/Administrative Assistant,"Rech Law, P.C.","$30,000 - $40,000 a year",Possess intermediate proficiency levels in answering phone calls from prospective clients.O Doing office filing daily;O Keeping the office tidy;
355,355,"Charlotte,NC",Professional Personal Assistant,Life Line Financial Group,$25 - $30 an hour,Flexibility to travel out of state with employer several times per year.Booking flight and hotel accommodations.Non - Profit experience a plus.
356,356,"Charlotte,NC",Data Entry Specialist,Randall-Reilly,,Requirements: High volume alpha numeric and 10-key data entry experience preferred.This role assists in building a high degree of confidence in our data to our…
357,357,"Charlotte,NC",Packer,The Home T,$12 - $15 an hour,Use a heat transfer machine to apply neck labels to shirts that need custom neck labeling.Work with print operators to make sure you are able to provide a…
358,358,"Charlotte,NC",Hiring Veterinary Receptionist,Uptown Veterinary Hospital,$13 - $17 an hour,Currently operating with the lobby closed to clients.A full-time position offers competitive pay commensurate with experience with benefits package:
359,359,"Charlotte,NC",Data Entry Clerk,Manpower,$17 an hour,FREE College and up skilling courses available.Clerical Document Processors will be responsible for data keying and expected to maintain high levels of…
360,360,"Charlotte,NC",Call Center Representative-Full Time-2 Shifts,American Red Cross,,Respond to or transfer inbound calls to the appropriate party.May develop new leads and implement new donor recruitment programs to ensure an increased donor…
361,361,"Charlotte,NC",Warehouse/Material Handler,Frito-Lay North America,$18.43 an hour,Safely operate a forklift after we provide you training and you obtain certification.Load trailers via carts or stack cases on the floor of a truck trailer.
362,362,"Charlotte,NC",Cash Management Services Teller,"Loomis Armored US, LLC",$14 an hour,"Ability to perform simple computer data entry.Separate currency, coin, and/or check deposits received from bank, ATM, and/or commercial customers providing…"
363,363,"Charlotte,NC",,Dust and Mop Cleaning,$700 - $800 a week,Work closely with Shirley and Darleen as they teach you how to make top pay in a few weeks time.- Have good work supplies provided for you*.
364,364,"Charlotte,NC",Professional Personal Assistant,Life Line Financial Group,$25 - $30 an hour,Flexibility to travel out of state with employer several times per year.Booking flight and hotel accommodations.Non - Profit experience a plus.
365,365,"Charlotte,NC",Data Entry Clerk,Manpower,$17 an hour,FREE College and up skilling courses available.Clerical Document Processors will be responsible for data keying and expected to maintain high levels of…
366,366,"Charlotte,NC",Customer Service Agent,Williams-Sonoma Inc. Customer Care Centers,$14 an hour,"Agents are trained in taking calls to assist customers with anything from placing orders and facilitating returns, to locating products and scheduling…"
367,367,"Charlotte,NC",Mail Clerk,Manpower,$16 an hour,"Prepare incoming and outgoing mail for distribution.Use hand or mail handling machines to time stamp, open, read, sort, and route incoming mail; and address,…"
368,368,"Charlotte,NC",Guest Advocate (Cashier or Front of Store Attendant/ Cart At...,TARGET,,Make a connection with guests by engaging in friendly and genuine conversation throughout each transaction; asking open ended questions about the guest’s…
369,369,"Charlotte,NC",Registrar -Hospital- 7:30PM-6:00AM,Atrium Health,,"Receives and provides information to patients, significant others, healthcare team members and hospital guests in a courteous and professional manner."
370,370,"Charlotte,NC",Customer Care Associate,Carewell,$13 - $18 an hour,"70% on calls: The bulk of your time will be spent answering calls from customers to assist with order placement, reorders, de-escalation, product questions and…"
371,371,"Charlotte,NC",Special Agent,Federal Bureau of Investigation,"$62,556 - $80,721 a year","Possess a valid driver’s license with at least six months driving experience.You will have an opportunity to work with federal, state and local law enforcement…"
372,372,"Charlotte,NC",Claims Adjuster Trainee,Progressive,"$48,000 a year","Bachelor's degree or a combined total of five years of work experience and/or college education.Diverse, inclusive & welcoming culture with Employee Resource…"
373,373,"Charlotte,NC",Night Warehouse Selector Part Time,US Foods,Up to $26 an hour,"Recent experience (within past 6 months) in high endurance or highly physical activity or role preferred e.g. lifting/transferring patients, sports/fitness,…"
374,374,"Charlotte,NC",Front Office Associate/PCC,Crossing Paths LLC,$16 an hour,"You will be responsible for managing the front area which includes, customer service, making outbound calls from our customer database to schedule appointments,…"
375,375,"Charlotte,NC","Luxury Leasing Consultant: Structured Hours, Uncapped Bonuse...",The Connor Group,$19 - $22 an hour,"Full Benefits, Guaranteed Hours & Un-Capped Bonuses!Adaptable/flexible -- enjoys doing work that requires frequent shifts in direction."
376,376,"Charlotte,NC",Aquarist/Keeper I,Discovery Place Inc,,Certificates and Licenses: Must have a valid NC Driver's license.Education/Experience: Bachelor's degree in biology or related field from a four-year college…
377,377,"Charlotte,NC",Transportation Security Officer (TSO),Transportation Security Administration,$16.72 - $23.88 an hour,"Per the President's 2014 Fair Employment memo, TSA policy is to not adversely consider a candidate based on unemployment or financial difficulty through no…"
378,378,"Charlotte,NC",,HomeSight Appraisal,,"This is a W2 employee position.Office setting with office support, computer, ACI software and in-office supplies provided for your use."
379,379,"Charlotte,NC",COVID-19 Vaccination Call Center Rep - Remote / Work from Ho...,Maximus,$17 - $18 an hour,Agents will answer incoming calls from the public related to COVID-19 vaccination scheduling.Strong data entry and telephone skills.
380,380,"Charlotte,NC",Warehouse Package Handler,FedEx Ground PH US,$15 - $16 an hour ++,FedEx Ground is hiring part-time and full-time individuals to load and unload packages in our fast-paced warehouse environment.
381,381,"Charlotte,NC",Veterinarian,Cotswold Animal Hospital,"$98,000 - $150,000 a year","Job Types: Full-time, Part-time.Veterinary Experience: 1 year (Preferred).Personal protective equipment provided or required."
382,382,"Charlotte,NC",Lead Maintenance Technician,Elite Line Services,$27.12 - $28.55 an hour,"Maintain and troubleshoot all conveyor systems, electrical and mechanical.Degree from a vocational school or college with a focus in the Mechanical or…"
383,383,"Charlotte,NC",Operating Room Manager,SouthPark Surgery Center,$25 - $55 an hour,The Operating Room Manager is responsible for the day to day operations of six operating rooms.The OR manager provides direction and oversight to sterile…
384,384,"Charlotte,NC",Customer Service Agent,Williams-Sonoma Inc. Customer Care Centers,$14 an hour,"Agents are trained in taking calls to assist customers with anything from placing orders and facilitating returns, to locating products and scheduling…"
385,385,"Charlotte,NC",Registrar -Hospital- 7:30PM-6:00AM,Atrium Health,,"Receives and provides information to patients, significant others, healthcare team members and hospital guests in a courteous and professional manner."
386,386,"Charlotte,NC","Store Associate - Charlotte, NC (W. Mallard Creek) (Full Tim...",Lidl US,$14.50 an hour,"DailyPay, a voluntary benefit to offer employees access to their pay on their own schedule.More than just cashiers, however, they get involved in every part of…"
387,387,"Charlotte,NC",Aquarist/Keeper I,Discovery Place Inc,,Certificates and Licenses: Must have a valid NC Driver's license.Education/Experience: Bachelor's degree in biology or related field from a four-year college…
388,388,"Charlotte,NC",Front Office Associate/PCC,Crossing Paths LLC,$16 an hour,"You will be responsible for managing the front area which includes, customer service, making outbound calls from our customer database to schedule appointments,…"
389,389,"Charlotte,NC",Appointment Setter - Interview This Week,The Williams Group of FL,"$800 - $1,200 a week","Own a reliable vehicle and have a driver's license.We fully train, so no experience is required for this position.Weekly pay and weekly bonuses."
390,390,"Charlotte,NC",Claims Adjuster Trainee,Progressive,"$48,000 a year","Bachelor's degree or a combined total of five years of work experience and/or college education.Diverse, inclusive & welcoming culture with Employee Resource…"
391,391,"Charlotte,NC",Guest Advocate (Cashier or Front of Store Attendant/ Cart At...,TARGET,,Make a connection with guests by engaging in friendly and genuine conversation throughout each transaction; asking open ended questions about the guest’s…
392,392,"Charlotte,NC","Customer Service Representative, Afternoon Shift",Ally Financial Inc.,$19.25 an hour,"The communication tools you'll have at your fingers will include channels such as inbound calls, outbound calls, click-to-chat, and secure messaging."
393,393,"Charlotte,NC",Office Administrator,Gentry Dental,$18 - $25 an hour,Dental receptionist: 1 year (Required).Candidates must live within a reasonable driving distance to SouthPark.Reconciling bank and credit accounts.
394,394,"Charlotte,NC",cashier-9,Michaels,,Participate in the truck un-load and stocking processes to ensure truck standards are followed and completed within budget.Execute cash handling to standards.
395,395,"Charlotte,NC",Find jobs with Flexible Hours!,Indeed Gigs,,"Whether it’s hiring for online work from home, part time, entry level or no experience jobs, you get to have flexible schedule!"
396,396,"Charlotte,NC",Customer Service Agent,Williams-Sonoma Inc. Customer Care Centers,$14 an hour,"Agents are trained in taking calls to assist customers with anything from placing orders and facilitating returns, to locating products and scheduling…"
397,397,"Charlotte,NC",Professional Personal Assistant,Life Line Financial Group,$25 - $30 an hour,Flexibility to travel out of state with employer several times per year.Booking flight and hotel accommodations.Non - Profit experience a plus.
398,398,"Charlotte,NC",,Dust and Mop Cleaning,$700 - $800 a week,Work closely with Shirley and Darleen as they teach you how to make top pay in a few weeks time.- Have good work supplies provided for you*.
399,399,"Charlotte,NC",Guest Advocate (Cashier or Front of Store Attendant/ Cart At...,TARGET,,Make a connection with guests by engaging in friendly and genuine conversation throughout each transaction; asking open ended questions about the guest’s…
400,400,"Charlotte,NC",Registrar -Hospital- 7:30PM-6:00AM,Atrium Health,,"Receives and provides information to patients, significant others, healthcare team members and hospital guests in a courteous and professional manner."
401,401,"Charlotte,NC",Data Entry Clerk,Manpower,$17 an hour,FREE College and up skilling courses available.Clerical Document Processors will be responsible for data keying and expected to maintain high levels of…
402,402,"Charlotte,NC",Special Agent,Federal Bureau of Investigation,"$62,556 - $80,721 a year","Possess a valid driver’s license with at least six months driving experience.You will have an opportunity to work with federal, state and local law enforcement…"
403,403,"Charlotte,NC",Claims Adjuster Trainee,Progressive,"$48,000 a year","Bachelor's degree or a combined total of five years of work experience and/or college education.Diverse, inclusive & welcoming culture with Employee Resource…"
404,404,"Charlotte,NC",Mail Clerk,Manpower,$16 an hour,"Prepare incoming and outgoing mail for distribution.Use hand or mail handling machines to time stamp, open, read, sort, and route incoming mail; and address,…"
405,405,"Charlotte,NC",Night Warehouse Selector Part Time,US Foods,Up to $26 an hour,"Recent experience (within past 6 months) in high endurance or highly physical activity or role preferred e.g. lifting/transferring patients, sports/fitness,…"
406,406,"Charlotte,NC",Front Office Associate/PCC,Crossing Paths LLC,$16 an hour,"You will be responsible for managing the front area which includes, customer service, making outbound calls from our customer database to schedule appointments,…"
407,407,"Charlotte,NC",Aquarist/Keeper I,Discovery Place Inc,,Certificates and Licenses: Must have a valid NC Driver's license.Education/Experience: Bachelor's degree in biology or related field from a four-year college…
408,408,"Charlotte,NC",Transportation Security Officer (TSO),Transportation Security Administration,$16.72 - $23.88 an hour,"Per the President's 2014 Fair Employment memo, TSA policy is to not adversely consider a candidate based on unemployment or financial difficulty through no…"
409,409,"Charlotte,NC",Recreation Specialist,Mecklenburg County Government,$16 - $20 an hour,Licenses and Certifications*: Position may require a valid North Carolina or South Carolina’s driver’s license and the ability to obtain and maintain a County…
410,410,"Charlotte,NC",Office Administrator,Gentry Dental,$18 - $25 an hour,Dental receptionist: 1 year (Required).Candidates must live within a reasonable driving distance to SouthPark.Reconciling bank and credit accounts.
411,411,"Charlotte,NC",,Maximus,$17 - $18 an hour,Agents will answer incoming calls from the public related to COVID-19 vaccination scheduling.Strong data entry and telephone skills.
412,412,"Charlotte,NC",cashier-9,Michaels,,Participate in the truck un-load and stocking processes to ensure truck standards are followed and completed within budget.Execute cash handling to standards.
413,413,"Charlotte,NC",Full-Time Maid/House Cleaner $700-800 paid Weekly,Dust and Mop Cleaning,$700 - $800 a week,Work closely with Shirley and Darleen as they teach you how to make top pay in a few weeks time.- Have good work supplies provided for you*.
414,414,"Charlotte,NC",Data Entry Clerk,Manpower,$17 an hour,FREE College and up skilling courses available.Clerical Document Processors will be responsible for data keying and expected to maintain high levels of…
415,415,"Charlotte,NC",SAP PP Consultant,Mann+Hummel,,Coordinate with the Corporate IT Team in reviewing technical design and development.Bachelor’s in Computer Science or related field (required).
416,416,"Charlotte,NC",Full Time Reg. Veterinary Tech or Exp. Vet. Asst.,Hight Veterinary Hospital,$12 - $18 an hour,Administer and monitor anesthesia in accordance with state regulations.Perform routine dental cleanings in accordance with state regulations.
417,417,"Charlotte,NC",Guest Advocate (Cashier or Front of Store Attendant/ Cart At...,TARGET,,Make a connection with guests by engaging in friendly and genuine conversation throughout each transaction; asking open ended questions about the guest’s…
418,418,"Charlotte,NC",Registrar -Hospital- 7:30PM-6:00AM,Atrium Health,,"Receives and provides information to patients, significant others, healthcare team members and hospital guests in a courteous and professional manner."
419,419,"Charlotte,NC",Full-Time Store Associate,ALDI,$13.50 an hour,Meet any state and local requirements for handling and selling alcoholic beverages.Adheres to cash policies and procedures to minimize losses.
420,420,"Charlotte,NC",Special Agent,Federal Bureau of Investigation,"$62,556 - $80,721 a year","Possess a valid driver’s license with at least six months driving experience.You will have an opportunity to work with federal, state and local law enforcement…"
421,421,"Charlotte,NC",Claims Adjuster Trainee,Progressive,"$48,000 a year","Bachelor's degree or a combined total of five years of work experience and/or college education.Diverse, inclusive & welcoming culture with Employee Resource…"
422,422,"Charlotte,NC",Night Warehouse Selector Part Time,US Foods,Up to $26 an hour,"Recent experience (within past 6 months) in high endurance or highly physical activity or role preferred e.g. lifting/transferring patients, sports/fitness,…"
423,423,"Charlotte,NC",Front Office Associate/PCC,Crossing Paths LLC,$16 an hour,"You will be responsible for managing the front area which includes, customer service, making outbound calls from our customer database to schedule appointments,…"
424,424,"Charlotte,NC",Aquarist/Keeper I,Discovery Place Inc,,Certificates and Licenses: Must have a valid NC Driver's license.Education/Experience: Bachelor's degree in biology or related field from a four-year college…
425,425,"Charlotte,NC","Store Associate - Charlotte, NC (W. Mallard Creek) (Full Tim...",Lidl US,$14.50 an hour,"DailyPay, a voluntary benefit to offer employees access to their pay on their own schedule.More than just cashiers, however, they get involved in every part of…"
426,426,"Charlotte,NC",Transportation Security Officer (TSO),Transportation Security Administration,$16.72 - $23.88 an hour,"Per the President's 2014 Fair Employment memo, TSA policy is to not adversely consider a candidate based on unemployment or financial difficulty through no…"
427,427,"Charlotte,NC",Warehouse Package Handler,FedEx Ground PH US,$15 - $16 an hour ++,FedEx Ground is hiring part-time and full-time individuals to load and unload packages in our fast-paced warehouse environment.
428,428,"Charlotte,NC",Find jobs with Flexible Hours!,Indeed Gigs,,"Whether it’s hiring for online work from home, part time, entry level or no experience jobs, you get to have flexible schedule!"
429,429,"Charlotte,NC",Find jobs with Flexible Hours!,Indeed Gigs,,"Whether it’s hiring for online work from home, part time, entry level or no experience jobs, you get to have flexible schedule!"
430,430,"Charlotte,NC",,FedEx Ground PH US,,FedEx Ground is hiring part-time and full-time individuals to load and unload packages in our fast-paced warehouse environment.
