,Unnamed: 0,City,title,company,salary,summary
0,0,"Charlotte,NC",,The Connor Group,"$75,000 - $110,000 a year","Real advancement opportunities based off performance.Outstanding compensation and bonus plan.Best in the industry benefits, 401k, longevity bonus and more!"
1,1,"Charlotte,NC",Data Entry Specialist,Randall-Reilly,,Requirements: High volume alpha numeric and 10-key data entry experience preferred.This role assists in building a high degree of confidence in our data to our…
2,2,"Charlotte,NC",Warehouse/Material Handler,Frito-Lay North America,$18.43 an hour,Safely operate a forklift after we provide you training and you obtain certification.Load trailers via carts or stack cases on the floor of a truck trailer.
3,3,"Charlotte,NC",Warehouse Team Member,Amazon HVH,,"Overnight, Early Morning, Day, Evening, Weekend.From flexible part-time roles to full-time set schedules with health care benefits, Amazon has a variety of…"
4,4,"Charlotte,NC",Front Desk Receptionist,Movement School,$13 - $14 an hour,Answer the telephone and take messages when necessary.Answering and routing phone calls.Interact with all visitors in a pleasant and efficient manner.
5,5,"Charlotte,NC",Immediate Opening- Assistant Front Desk,CDS Concierge,$14 - $17 an hour,Maintain an active presence in the concierge lobby to greet and assist incoming guests.Give courtesy calls to new move ins and find ways to impress guest and…
6,6,"Charlotte,NC",Warehouse Associate,Tesla,,"Must have a valid state driver’s license.This will include receiving, issuing, and organizing materials for maximum efficiency; and preparing material daily to…"
7,7,"Charlotte,NC",Special Agent,Federal Bureau of Investigation,"$62,556 - $80,721 a year","Possess a valid driver’s license with at least six months driving experience.You will have an opportunity to work with federal, state and local law enforcement…"
8,8,"Charlotte,NC",Customer Service Agent,Williams-Sonoma Inc. Customer Care Centers,$14 an hour,"Agents are trained in taking calls to assist customers with anything from placing orders and facilitating returns, to locating products and scheduling…"
9,9,"Charlotte,NC",DA Victim Services Coordinator,North Carolina District Attorney,"$32,780 - $38,769 a year","Skill in: Microsoft Office Word, Excel, Outlook, and PowerPoint; accurately typing 35-40 wpm; and answering a multi-line telephone system."
10,10,"Charlotte,NC",Front Desk Receptionist,Jeffrey Kleinheinz DDS PA,$18 - $20 an hour,Answering and routing phone calls.We need someone with a great smile to greet our patients by name and be the face of our practice.
11,11,"Charlotte,NC",Recreation Specialist,Mecklenburg County Government,$16 - $20 an hour,Licenses and Certifications*: Position may require a valid North Carolina or South Carolina’s driver’s license and the ability to obtain and maintain a County…
12,12,"Charlotte,NC",Rail Car Technician,City of Charlotte and Mecklenburg County,$25.25 - $33.14 an hour,"Must have a valid driver's license and the ability to attain a North Carolina driver's license within the timelines outlined by CATS and the City of Charlotte,…"
13,13,"Charlotte,NC",Pharmaceutical Sales Representative (Entry Level - Primary C...,Prism Pharmaceutical,"$71,300 - $94,100 a year",Possess a valid driver’s license.Ability to understand and communicate highly scientific and technical medical information.
14,14,"Charlotte,NC",Front Office Associate/PCC,Crossing Paths LLC,$16 an hour,"You will be responsible for managing the front area which includes, customer service, making outbound calls from our customer database to schedule appointments,…"
15,15,"Charlotte,NC",Production and Packaging Team Member,Sycamore Brewing,$13 - $17 an hour,This position is considered entry-level and will focus on the packaging side of our production operations.Participate in brewery/tap room events and festivals.
16,16,"Charlotte,NC",Professional Personal Assistant,Life Line Financial Group,$25 - $30 an hour,Flexibility to travel out of state with employer several times per year.Booking flight and hotel accommodations.Non - Profit experience a plus.
17,17,"Charlotte,NC",Warehouse/Shopper Team Member,Amazon HVH,,"If you need flexibility in your schedule, this job allows you to choose from available shifts each week to create your own.Work a set, full-time schedule."
18,18,"Charlotte,NC",,Sitel,,"Receive and process chats, calls and/or emails to answer customer questions, address their concerns and help them with a particular product or service."
19,19,"Charlotte,NC",Legal Secretary,"Griffin, Brunson & Wood, LLP","$24,000 a year","The duties are, but not limited to: greeting and checking in clients, answering the multi-line phone, collection and distribution of mail, maintaining our…"
20,20,"Charlotte,NC",Scheduling Coordinator,Sisco Safety,"$45,000 - $50,000 a year",Establish long-range goals and design plans to attain them.Identify and evaluate resources and plan for their utilization throughout the execution of…
21,21,"Charlotte,NC",Cash Management Services Teller,"Loomis Armored US, LLC",$14 an hour,"Ability to perform simple computer data entry.Separate currency, coin, and/or check deposits received from bank, ATM, and/or commercial customers providing…"
22,22,"Charlotte,NC",Hiring Veterinary Receptionist,Uptown Veterinary Hospital,$13 - $17 an hour,Currently operating with the lobby closed to clients.A full-time position offers competitive pay commensurate with experience with benefits package:
23,23,"Charlotte,NC",Front Desk Receptionist,Movement School,$13 - $14 an hour,Answer the telephone and take messages when necessary.Answering and routing phone calls.Interact with all visitors in a pleasant and efficient manner.
24,24,"Charlotte,NC","Server, Bartender, Busser, Runner, Guest Services - Charlott...",Topgolf,,"If extended the invitation, we’ll be ready to welcome you to an interview with guidelines around social distancing and interview protocols to help keep you safe…"
25,25,"Charlotte,NC",Warehouse/Material Handler,Frito-Lay North America,$18.43 an hour,Safely operate a forklift after we provide you training and you obtain certification.Load trailers via carts or stack cases on the floor of a truck trailer.
26,26,"Charlotte,NC",Data Entry Specialist,Randall-Reilly,,Requirements: High volume alpha numeric and 10-key data entry experience preferred.This role assists in building a high degree of confidence in our data to our…
27,27,"Charlotte,NC",Front Office Assistant,BG Solutions,"$40,000 - $50,000 a year","In this role, your duties will include answering incoming calls, scheduling appointments, and welcoming visitors.Copying, scanning, and filing documents."
28,28,"Charlotte,NC",Appointment Setter - Interview This Week,The Williams Group of FL,"$800 - $1,200 a week","Own a reliable vehicle and have a driver's license.We fully train, so no experience is required for this position.Weekly pay and weekly bonuses."
29,29,"Charlotte,NC","Assistant, Media Center / 2021-22",Charlotte-Mecklenburg Schools,$15 an hour,"Provides basic instruction and guidance to students using educational computer hardware and software.Duties include maintaining media center collections,…"
30,30,"Charlotte,NC",Mail Clerk,Manpower,$16 an hour,"Prepare incoming and outgoing mail for distribution.Use hand or mail handling machines to time stamp, open, read, sort, and route incoming mail; and address,…"
31,31,"Charlotte,NC",Customer Care Associate,Carewell,$13 - $18 an hour,"70% on calls: The bulk of your time will be spent answering calls from customers to assist with order placement, reorders, de-escalation, product questions and…"
32,32,"Charlotte,NC",Immediate Opening- Assistant Front Desk,CDS Concierge,$14 - $17 an hour,Maintain an active presence in the concierge lobby to greet and assist incoming guests.Give courtesy calls to new move ins and find ways to impress guest and…
33,33,"Charlotte,NC",Warehouse Associate,Tesla,,"Must have a valid state driver’s license.This will include receiving, issuing, and organizing materials for maximum efficiency; and preparing material daily to…"
34,34,"Charlotte,NC",Front Desk Associate,Xclusive Staffing - Corporate,$13 an hour,Xclusive Staffing is currently seeking a Front Desk Associate to ensure successful operation of front desk and all administrative functions.
35,35,"Charlotte,NC",Special Agent,Federal Bureau of Investigation,"$62,556 - $80,721 a year","Possess a valid driver’s license with at least six months driving experience.You will have an opportunity to work with federal, state and local law enforcement…"
36,36,"Charlotte,NC",Customer Service Agent,Williams-Sonoma Inc. Customer Care Centers,$14 an hour,"Agents are trained in taking calls to assist customers with anything from placing orders and facilitating returns, to locating products and scheduling…"
37,37,"Charlotte,NC",DA Victim Services Coordinator,North Carolina District Attorney,"$32,780 - $38,769 a year","Skill in: Microsoft Office Word, Excel, Outlook, and PowerPoint; accurately typing 35-40 wpm; and answering a multi-line telephone system."
38,38,"Charlotte,NC",,The Connor Group,$19 - $22 an hour,"Full Benefits, Guaranteed Hours & Un-Capped Bonuses!Adaptable/flexible -- enjoys doing work that requires frequent shifts in direction."
39,39,"Charlotte,NC",Front Desk Receptionist,Jeffrey Kleinheinz DDS PA,$18 - $20 an hour,Answering and routing phone calls.We need someone with a great smile to greet our patients by name and be the face of our practice.
40,40,"Charlotte,NC",Recreation Specialist,Mecklenburg County Government,$16 - $20 an hour,Licenses and Certifications*: Position may require a valid North Carolina or South Carolina’s driver’s license and the ability to obtain and maintain a County…
41,41,"Charlotte,NC",Rail Car Technician,City of Charlotte and Mecklenburg County,$25.25 - $33.14 an hour,"Must have a valid driver's license and the ability to attain a North Carolina driver's license within the timelines outlined by CATS and the City of Charlotte,…"
42,42,"Charlotte,NC",Pharmaceutical Sales Representative (Entry Level - Primary C...,Prism Pharmaceutical,"$71,300 - $94,100 a year",Possess a valid driver’s license.Ability to understand and communicate highly scientific and technical medical information.
43,43,"Charlotte,NC",Front Office Associate/PCC,Crossing Paths LLC,$16 an hour,"You will be responsible for managing the front area which includes, customer service, making outbound calls from our customer database to schedule appointments,…"
44,44,"Charlotte,NC",Material Handler,Amazon.com Services LLC,,Must be able to continuously climb and descend stairs safely (applies to sites with stairs).Must be able to work on powered equipment-for example forklift or…
45,45,"Charlotte,NC",Find jobs with Flexible Hours!,Indeed Gigs,,"Whether it’s hiring for online work from home, part time, entry level or no experience jobs, you get to have flexible schedule!"
46,46,"Charlotte,NC",cashier-9,Michaels,,Participate in the truck un-load and stocking processes to ensure truck standards are followed and completed within budget.Execute cash handling to standards.
47,47,"Charlotte,NC",,Elite Line Services,$53 - $56 an hour,"Develop and design solutions to difficult problems, manage outside contractors and be on call for emergencies.Help to develop, set and track budgets."
48,48,"Charlotte,NC",Registered Nurse,Carolinas Continue Care Hospital,,"Related keywords: registered nurse, rn, nurse, nurse rn, rn nurse.Registered Nurse (Day and Night Shifts) .University Area Zip code 28262."
49,49,"Charlotte,NC",Auto Technician,CROWN AUTO SALES AND FINANCE,$14 - $20 an hour,Must have valid driver’s license and your OWN tools.If you do not have a valid driver’s license and tools please do not apply.Bi weekly or Twice monthly.
50,50,"Charlotte,NC",Child Care,Thompson Child & Family Focus,,"Teacher resource room and a tranquility room for relaxation breaks.A comprehensive and generous benefits package which includes health insurance, dental…"
51,51,"Charlotte,NC",Warehouse Package Handler,FedEx Ground PH US,$15 - $16 an hour ++,FedEx Ground is hiring part-time and full-time individuals to load and unload packages in our fast-paced warehouse environment.
52,52,"Charlotte,NC",Police Records Clerk,Town of Dallas,$32 an hour,"In addition to this, the Police Records Clerk may also perform other clerical duties assisting officers with information and answering the phone."
53,53,"Charlotte,NC",Special Agent,Federal Bureau of Investigation,"$62,556 - $80,721 a year","Possess a valid driver’s license with at least six months driving experience.You will have an opportunity to work with federal, state and local law enforcement…"
54,54,"Charlotte,NC",Guest Advocate (Cashier or Front of Store Attendant/ Cart At...,TARGET,,Make a connection with guests by engaging in friendly and genuine conversation throughout each transaction; asking open ended questions about the guest’s…
55,55,"Charlotte,NC",Child Life Assistant - Levine Children's Hospital,Atrium Health,,"Assists with special groups, activities and events.Maintains competency as appropriate to the ages, developmental stages, and special needs of the patients…"
56,56,"Charlotte,NC",Fleet Service Agent Part Time,American Airlines,,Applicable valid driver’s license as required by local authorities.Ability to obtain jet bridge certification.Clean interior of aircraft when needed.
57,57,"Charlotte,NC",General Warehouse Associate,Family Dollar,Up to $16.90 an hour,"Applicants with disabilities may contact Dollar Tree coordinators via telephone, fax, e-mail, and other means to request and arrange for accommodations."
58,58,"Charlotte,NC",Human Resources Officer,US Department of Justice,"$78,484 - $102,033 a year","Experience refers to paid and unpaid experience, including volunteer work done through National Service programs (e.g., Peace Corps, AmeriCorps) and other…"
59,59,"Charlotte,NC",Secretary - 10 Month 20-21 SY,Charlotte-Mecklenburg Schools,$15 an hour,"Acts as a receptionist, responds to requests and inquiries and assists visitors with directions and information.Opens, sorts and distributes incoming mail."
60,60,"Charlotte,NC",Customer Service Agent,Williams-Sonoma Inc. Customer Care Centers,$14 an hour,"Agents are trained in taking calls to assist customers with anything from placing orders and facilitating returns, to locating products and scheduling…"
61,61,"Charlotte,NC",Data Entry Clerk,Manpower,$17 an hour,FREE College and up skilling courses available.Clerical Document Processors will be responsible for data keying and expected to maintain high levels of…
62,62,"Charlotte,NC",COVID-19 Vaccination Call Center Rep - Remote / Work from Ho...,Maximus,$17 - $18 an hour,Agents will answer incoming calls from the public related to COVID-19 vaccination scheduling.Strong data entry and telephone skills.
63,63,"Charlotte,NC",Patient Support Specialist,Lemonaid Health,$14 an hour,"Comfortable with handling a high volume of calls and emails, while upholding our customer commitment of answering calls within 60 seconds and replying to emails…"
64,64,"Charlotte,NC",Route Sales Representative,Frito-Lay North America,"$50,000 a year","As a Route Sales Representative, you would drive a small Frito-Lay truck which requires a regular driver's license and insurance."
65,65,"Charlotte,NC","Warehouse Processing, Packaging, & Shipping Associate $13-16...",JLS Trading Co,$13 - $16 an hour,"Working on a small manufacturing line to assemble units, package them, apply a label, then box up the finished unit.Moving pallets around the warehouse."
66,66,"Charlotte,NC",Receptionist/Administrative Assistant,"Rech Law, P.C.","$30,000 - $40,000 a year",Possess intermediate proficiency levels in answering phone calls from prospective clients.O Doing office filing daily;O Keeping the office tidy;
67,67,"Charlotte,NC",,Dust and Mop Cleaning,$700 - $800 a week,Work closely with Shirley and Darleen as they teach you how to make top pay in a few weeks time.- Have good work supplies provided for you*.
68,68,"Charlotte,NC",Professional Personal Assistant,Life Line Financial Group,$25 - $30 an hour,Flexibility to travel out of state with employer several times per year.Booking flight and hotel accommodations.Non - Profit experience a plus.
69,69,"Charlotte,NC",Data Entry Specialist,Randall-Reilly,,Requirements: High volume alpha numeric and 10-key data entry experience preferred.This role assists in building a high degree of confidence in our data to our…
70,70,"Charlotte,NC",Packer,The Home T,$12 - $15 an hour,Use a heat transfer machine to apply neck labels to shirts that need custom neck labeling.Work with print operators to make sure you are able to provide a…
71,71,"Charlotte,NC",Warehouse/Material Handler,Frito-Lay North America,$18.43 an hour,Safely operate a forklift after we provide you training and you obtain certification.Load trailers via carts or stack cases on the floor of a truck trailer.
72,72,"Charlotte,NC",Hiring Veterinary Receptionist,Uptown Veterinary Hospital,$13 - $17 an hour,Currently operating with the lobby closed to clients.A full-time position offers competitive pay commensurate with experience with benefits package:
73,73,"Charlotte,NC",Call Center Representative-Full Time-2 Shifts,American Red Cross,,Respond to or transfer inbound calls to the appropriate party.May develop new leads and implement new donor recruitment programs to ensure an increased donor…
74,74,"Charlotte,NC",Cash Management Services Teller,"Loomis Armored US, LLC",$14 an hour,"Ability to perform simple computer data entry.Separate currency, coin, and/or check deposits received from bank, ATM, and/or commercial customers providing…"
75,75,"Charlotte,NC",Customer Service Agent,Williams-Sonoma Inc. Customer Care Centers,$14 an hour,"Agents are trained in taking calls to assist customers with anything from placing orders and facilitating returns, to locating products and scheduling…"
76,76,"Charlotte,NC",Immediate Opening- Weekend Overnight Front Desk,CDS Concierge,$11 - $13 an hour,"Promptly answer, record, and complete all resident requests, phone calls, questions, or concerns.Our goal as Concierge is to provide a very friendly and…"
77,77,"Charlotte,NC",Data Entry Clerk,Manpower,$17 an hour,FREE College and up skilling courses available.Clerical Document Processors will be responsible for data keying and expected to maintain high levels of…
78,78,"Charlotte,NC",Warehouse Team Member,Amazon HVH,,"Overnight, Early Morning, Day, Evening, Weekend.From flexible part-time roles to full-time set schedules with health care benefits, Amazon has a variety of…"
79,79,"Charlotte,NC",Patient Support Specialist,Lemonaid Health,$14 an hour,"Comfortable with handling a high volume of calls and emails, while upholding our customer commitment of answering calls within 60 seconds and replying to emails…"
80,80,"Charlotte,NC",,Dust and Mop Cleaning,$700 - $800 a week,Work closely with Shirley and Darleen as they teach you how to make top pay in a few weeks time.- Have good work supplies provided for you*.
81,81,"Charlotte,NC",Route Sales Representative,Frito-Lay North America,"$50,000 a year","As a Route Sales Representative, you would drive a small Frito-Lay truck which requires a regular driver's license and insurance."
82,82,"Charlotte,NC","Warehouse Processing, Packaging, & Shipping Associate $13-16...",JLS Trading Co,$13 - $16 an hour,"Working on a small manufacturing line to assemble units, package them, apply a label, then box up the finished unit.Moving pallets around the warehouse."
83,83,"Charlotte,NC",Receptionist/Administrative Assistant,"Rech Law, P.C.","$30,000 - $40,000 a year",Possess intermediate proficiency levels in answering phone calls from prospective clients.O Doing office filing daily;O Keeping the office tidy;
84,84,"Charlotte,NC",Professional Personal Assistant,Life Line Financial Group,$25 - $30 an hour,Flexibility to travel out of state with employer several times per year.Booking flight and hotel accommodations.Non - Profit experience a plus.
85,85,"Charlotte,NC",Data Entry Specialist,Randall-Reilly,,Requirements: High volume alpha numeric and 10-key data entry experience preferred.This role assists in building a high degree of confidence in our data to our…
86,86,"Charlotte,NC",Packer,The Home T,$12 - $15 an hour,Use a heat transfer machine to apply neck labels to shirts that need custom neck labeling.Work with print operators to make sure you are able to provide a…
87,87,"Charlotte,NC",Hiring Veterinary Receptionist,Uptown Veterinary Hospital,$13 - $17 an hour,Currently operating with the lobby closed to clients.A full-time position offers competitive pay commensurate with experience with benefits package:
88,88,"Charlotte,NC",Data Entry Clerk,Manpower,$17 an hour,FREE College and up skilling courses available.Clerical Document Processors will be responsible for data keying and expected to maintain high levels of…
89,89,"Charlotte,NC",Call Center Representative-Full Time-2 Shifts,American Red Cross,,Respond to or transfer inbound calls to the appropriate party.May develop new leads and implement new donor recruitment programs to ensure an increased donor…
90,90,"Charlotte,NC",Warehouse/Material Handler,Frito-Lay North America,$18.43 an hour,Safely operate a forklift after we provide you training and you obtain certification.Load trailers via carts or stack cases on the floor of a truck trailer.
91,91,"Charlotte,NC",Cash Management Services Teller,"Loomis Armored US, LLC",$14 an hour,"Ability to perform simple computer data entry.Separate currency, coin, and/or check deposits received from bank, ATM, and/or commercial customers providing…"
92,92,"Charlotte,NC",Immediate Opening- Weekend Overnight Front Desk,CDS Concierge,$11 - $13 an hour,"Promptly answer, record, and complete all resident requests, phone calls, questions, or concerns.Our goal as Concierge is to provide a very friendly and…"
93,93,"Charlotte,NC",Mail Clerk,Manpower,$16 an hour,"Prepare incoming and outgoing mail for distribution.Use hand or mail handling machines to time stamp, open, read, sort, and route incoming mail; and address,…"
94,94,"Charlotte,NC",Immediate Opening- Assistant Front Desk,CDS Concierge,$14 - $17 an hour,Maintain an active presence in the concierge lobby to greet and assist incoming guests.Give courtesy calls to new move ins and find ways to impress guest and…
95,95,"Charlotte,NC",Warehouse Associate,Tesla,,"Must have a valid state driver’s license.This will include receiving, issuing, and organizing materials for maximum efficiency; and preparing material daily to…"
96,96,"Charlotte,NC",Customer Care Associate,Carewell,$13 - $18 an hour,"70% on calls: The bulk of your time will be spent answering calls from customers to assist with order placement, reorders, de-escalation, product questions and…"
97,97,"Charlotte,NC",Special Agent,Federal Bureau of Investigation,"$62,556 - $80,721 a year","Possess a valid driver’s license with at least six months driving experience.You will have an opportunity to work with federal, state and local law enforcement…"
98,98,"Charlotte,NC",Customer Service Agent,Williams-Sonoma Inc. Customer Care Centers,$14 an hour,"Agents are trained in taking calls to assist customers with anything from placing orders and facilitating returns, to locating products and scheduling…"
99,99,"Charlotte,NC",DA Victim Services Coordinator,North Carolina District Attorney,"$32,780 - $38,769 a year","Skill in: Microsoft Office Word, Excel, Outlook, and PowerPoint; accurately typing 35-40 wpm; and answering a multi-line telephone system."
100,100,"Charlotte,NC",Guest Services Representative,Novant Health,,Licensure/certification/registration: Valid state driver’s license at facilities where valet assistance may be needed is required.
101,101,"Charlotte,NC",Front Desk Receptionist,Jeffrey Kleinheinz DDS PA,$18 - $20 an hour,Answering and routing phone calls.We need someone with a great smile to greet our patients by name and be the face of our practice.
102,102,"Charlotte,NC",Recreation Specialist,Mecklenburg County Government,$16 - $20 an hour,Licenses and Certifications*: Position may require a valid North Carolina or South Carolina’s driver’s license and the ability to obtain and maintain a County…
103,103,"Charlotte,NC",Rail Car Technician,City of Charlotte and Mecklenburg County,$25.25 - $33.14 an hour,"Must have a valid driver's license and the ability to attain a North Carolina driver's license within the timelines outlined by CATS and the City of Charlotte,…"
104,104,"Charlotte,NC",Pharmaceutical Sales Representative (Entry Level - Primary C...,Prism Pharmaceutical,"$71,300 - $94,100 a year",Possess a valid driver’s license.Ability to understand and communicate highly scientific and technical medical information.
105,105,"Charlotte,NC",Front Office Associate/PCC,Crossing Paths LLC,$16 an hour,"You will be responsible for managing the front area which includes, customer service, making outbound calls from our customer database to schedule appointments,…"
106,106,"Charlotte,NC",Material Handler,Amazon.com Services LLC,,Must be able to continuously climb and descend stairs safely (applies to sites with stairs).Must be able to work on powered equipment-for example forklift or…
107,107,"Charlotte,NC",Fleet Service Agent Part Time,American Airlines,,Applicable valid driver’s license as required by local authorities.Ability to obtain jet bridge certification.Clean interior of aircraft when needed.
108,108,"Charlotte,NC",Receptionist/Administrative Assistant,"Rech Law, P.C.","$30,000 - $40,000 a year",Possess intermediate proficiency levels in answering phone calls from prospective clients.O Doing office filing daily;O Keeping the office tidy;
